{
  "schema": "narada.ledger-domain.v1",
  "identity": {
    "domain_id": "epistemic-graph",
    "tool_prefix": "epistemic_graph",
    "schema_namespace": "narada.epistemic",
    "error_schema_id": "narada.epistemic.error.v1",
    "implementation": "rust-native"
  },
  "storage": {
    "control_root_subdir": "epistemic",
    "runtime_subdir": ".ai/epistemic-graph",
    "ledger_file_prefix": "ev",
    "event_schema_id": "narada.epistemic.event.v1",
    "event_hash_field": "event_hash",
    "subdirs": {
      "ledger": "ledger",
      "proposals": "proposals",
      "sequences": "sequences"
    }
  },
  "entities": {
    "core_kinds": ["problem", "conjecture", "claim", "criticism", "test", "source", "team_member", "research_issue_tree", "research_issue", "narada.epistemic:communication"],
    "required_fields": {
      "always": ["kind", "title"],
      "conditional": [
        {"when_kind": "source", "requires": ["version", "locator"]},
        {"when_kind": "narada.epistemic:communication", "requires": ["sender", "recipient", "intent", "sent_at"]}
      ]
    },
    "extension_rule": {
      "must_contain": ":",
      "pattern": "<namespace>:<kind>",
      "examples": ["cintamani:experiment", "cintamani:equipment_type"],
      "refusal_code": "invalid_entity_kind"
    }
  },
  "relations": {
    "core": ["addresses", "criticizes", "tests", "depends_on", "derived_from", "transforms", "supersedes", "issue_child_of", "blocked_by", "sent_by", "addressed_to", "replies_to", "requests", "reports", "acknowledges", "promotes_to_evidence"],
    "extension_pattern": "^[A-Za-z][A-Za-z0-9_.-]*:[A-Za-z][A-Za-z0-9_.-]*$",
    "extension_rule": {
      "must_contain": ":",
      "pattern": "<namespace>:<relation>",
      "examples": ["marici:refines", "marici:generalizes"],
      "refusal_code": "invalid_relation_type"
    }
  },
  "operations": {
    "kinds": ["entity.declare", "entity.kind_canonicalize", "relation.declare", "assessment.record", "test_outcome.record", "sweep.record"],
    "count": {"min": 1, "max": 200},
    "additional_properties": true,
    "required_fields": {
      "entity.declare": ["op", "entity_id", "kind", "title"],
      "entity.kind_canonicalize": ["op", "entity_id", "legacy_kind", "canonical_kind"],
      "relation.declare": ["op", "relation_id", "relation_type", "source_id", "target_id"],
      "assessment.record": ["op", "assessment_id", "subject_id", "judgment", "actor", "reason"],
      "test_outcome.record": ["op", "outcome_id", "test_id", "actor", "outcome"],
      "sweep.record": ["op", "sweep_id", "interval_start", "interval_end", "method", "result"]
    },
    "evidence_entry": {
      "type": "object",
      "properties": {
        "source_id": {"type": "string", "minLength": 1},
        "locator": {"type": "string", "minLength": 1},
        "paraphrase": {"type": "string", "minLength": 1}
      },
      "required": ["source_id", "locator", "paraphrase"],
      "additionalProperties": false
    },
    "evidence_required_at_review": ["assessment.record", "test_outcome.record"],
    "reference_bindings": [
      {"operation": "relation.declare", "fields": ["source_id", "target_id"]},
      {"operation": "assessment.record", "fields": ["subject_id"]},
      {"operation": "test_outcome.record", "fields": ["test_id"]},
      {"operation": "*", "fields": ["evidence[].source_id"]}
    ],
    "reference_resolution_scope": ["projection_entities", "intra_proposal_entity_declares"],
    "schema": {
      "oneOf": [
        {"title": "Declare entity", "type": "object", "properties": {"op": {"const": "entity.declare"}, "entity_id": {"type": "string", "minLength": 1, "description": "Optional override; omit for deterministic identity from kind, title, version, and locator."}, "local_ref": {"type": "string", "minLength": 1, "description": "Optional proposal-local name for relation source_ref/target_ref."}, "kind": {"type": "string", "description": "Core entity kind (problem, conjecture, claim, criticism, test, source) or a namespaced extension kind such as cintamani:experiment."}, "title": {"type": "string", "minLength": 1}, "version": {"type": "string", "minLength": 1}, "locator": {"type": "string", "minLength": 1}}, "required": ["op", "kind", "title"], "allOf": [{"if": {"properties": {"kind": {"const": "source"}}, "required": ["kind"]}, "then": {"required": ["version", "locator"]}}], "additionalProperties": true},
        {"title": "Canonicalize entity kind", "type": "object", "properties": {"op": {"const": "entity.kind_canonicalize"}, "entity_id": {"type": "string", "minLength": 1}, "legacy_kind": {"type": "string", "enum": ["communication", "marici:communication"]}, "canonical_kind": {"const": "narada.epistemic:communication"}, "equivalence_evidence": {"type": "object", "properties": {"payload_sha256": {"type": "string", "pattern": "^[0-9a-f]{64}$"}, "originating_event_id": {"type": "string", "minLength": 1}}, "required": ["payload_sha256", "originating_event_id"], "additionalProperties": false}}, "required": ["op", "entity_id", "legacy_kind", "canonical_kind", "equivalence_evidence"], "additionalProperties": false},
        {"title": "Declare relation", "type": "object", "properties": {"op": {"const": "relation.declare"}, "relation_id": {"type": "string", "minLength": 1, "description": "Optional override. Omit to derive a deterministic id from relation_type, source_id, and target_id."}, "relation_type": {"oneOf": [{"type": "string", "enum": ["addresses", "criticizes", "tests", "depends_on", "derived_from", "transforms", "supersedes", "sent_by", "addressed_to", "replies_to", "requests", "reports", "acknowledges", "promotes_to_evidence"]}, {"type": "string", "pattern": "^[A-Za-z][A-Za-z0-9_.-]*:[A-Za-z][A-Za-z0-9_.-]*$"}], "description": "Use a listed core relation, or namespace an extension such as marici:refines."}, "source_id": {"type": "string", "minLength": 1}, "target_id": {"type": "string", "minLength": 1}, "source_ref": {"type": "string", "minLength": 1}, "target_ref": {"type": "string", "minLength": 1}}, "required": ["op", "relation_type"], "allOf": [{"anyOf": [{"required": ["source_id"]}, {"required": ["source_ref"]}]}, {"anyOf": [{"required": ["target_id"]}, {"required": ["target_ref"]}]}], "additionalProperties": true},
        {"title": "Record assessment", "type": "object", "properties": {"op": {"const": "assessment.record"}, "assessment_id": {"type": "string", "minLength": 1}, "subject_id": {"type": "string", "minLength": 1}, "judgment": {"type": "string", "minLength": 1}, "actor": {"type": "string", "minLength": 1}, "reason": {"type": "string", "minLength": 1}, "evidence": {"type": "array", "minItems": 1, "items": {"type": "object", "properties": {"source_id": {"type": "string", "minLength": 1}, "locator": {"type": "string", "minLength": 1}, "paraphrase": {"type": "string", "minLength": 1}}, "required": ["source_id", "locator", "paraphrase"], "additionalProperties": false}}}, "required": ["op", "assessment_id", "subject_id", "judgment", "actor", "reason", "evidence"], "additionalProperties": true},
        {"title": "Record test outcome", "type": "object", "properties": {"op": {"const": "test_outcome.record"}, "outcome_id": {"type": "string", "minLength": 1}, "test_id": {"type": "string", "minLength": 1}, "actor": {"type": "string", "minLength": 1}, "outcome": {"type": "string", "minLength": 1}, "evidence": {"type": "array", "minItems": 1, "items": {"type": "object", "properties": {"source_id": {"type": "string", "minLength": 1}, "locator": {"type": "string", "minLength": 1}, "paraphrase": {"type": "string", "minLength": 1}}, "required": ["source_id", "locator", "paraphrase"], "additionalProperties": false}}}, "required": ["op", "outcome_id", "test_id", "actor", "outcome", "evidence"], "additionalProperties": true},
        {"title": "Record bounded search sweep", "type": "object", "properties": {"op": {"const": "sweep.record"}, "sweep_id": {"type": "string", "minLength": 1}, "interval_start": {"type": "string", "minLength": 1}, "interval_end": {"type": "string", "minLength": 1}, "method": {"type": "string", "minLength": 1}, "result": {"type": "string", "minLength": 1}}, "required": ["op", "sweep_id", "interval_start", "interval_end", "method", "result"], "additionalProperties": true}
      ]
    }
  },
  "id_derivation": {
    "digest_rule": "hex sha256 of the compact serde_json::to_vec encoding; insertion-order dependent by design (docs/event-ledger-format.md)",
    "safe_name_rule": "ASCII alphanumerics, '-', '_'; bounded to 120 characters",
    "entity": {
      "applies_to": "entity.declare",
      "when": "entity_id absent and kind and title non-empty",
      "template": "{safe_name(kind)}:{digest[..20]}",
      "digest_input_fields": ["kind", "title", "version", "locator"],
      "digest_input_note": "version and locator are JSON null when absent (always null for non-source kinds)"
    },
    "relation": {
      "applies_to": "relation.declare",
      "when": "relation_id absent and relation_type, source_id, target_id non-empty",
      "template": "rel:{safe_name(relation_type)}-{sha256[..16]}",
      "hash_input": "{relation_type}\\0{source_id}\\0{target_id}"
    },
    "local_ref_wiring": {
      "declare_field": "local_ref",
      "uniqueness": "proposal",
      "duplicate_refusal_code": "duplicate_local_ref",
      "reference_fields": {"source_ref": "source_id", "target_ref": "target_id"},
      "unresolved_refusal_code": "local_ref_not_found"
    },
    "operation_identity_prefixes": {
      "entity.declare": {"prefix": "entity", "id_field": "entity_id"},
      "entity.kind_canonicalize": {"prefix": "entity_kind_canonicalize", "id_field": "entity_id"},
      "relation.declare": {"prefix": "relation", "id_field": "relation_id"},
      "assessment.record": {"prefix": "assessment", "id_field": "assessment_id"},
      "test_outcome.record": {"prefix": "test_outcome", "id_field": "outcome_id"},
      "sweep.record": {"prefix": "sweep", "id_field": "sweep_id"}
    },